{
  "$schema": "https://json-schema.org/draft/2020-12/schema",
  "$id": "chainsec/pack.schema.json",
  "title": "ChainSec chain pack manifest (paths are relative to the pack folder)",
  "type": "object",
  "required": ["chain", "id_prefix", "extensions", "detect", "scope", "tools", "extractor", "risk_weights",
               "loc_weight", "novelty_bonus", "value_bonus", "novelty_allowlist", "unit_of_analysis",
               "clustering", "value_unit", "code_fence", "modules_by_protocol", "poc", "fuzz"],
  "additionalProperties": false,
  "properties": {
    "chain": { "type": "string", "minLength": 1 },
    "id_prefix": { "type": "string", "minLength": 1 },
    "extensions": { "type": "array", "minItems": 1, "items": { "type": "string" } },
    "detect": { "type": "object", "required": ["markers"], "additionalProperties": false, "properties": {
      "markers": { "type": "array", "items": { "type": "string" } },
      "contains": { "type": "array", "items": { "type": "string" } },
      "fallback_glob": { "type": "string" } } },
    "scope": { "type": "object", "required": ["include", "exclude"], "additionalProperties": false, "properties": {
      "include": { "type": "array", "minItems": 1, "items": { "type": "string" } },
      "exclude": { "type": "array", "items": { "type": "string" } },
      "fallback_include": { "type": "array", "items": { "type": "string" } } } },
    "tools": { "type": "object", "required": ["required", "optional"], "additionalProperties": false, "properties": {
      "required": { "type": "array", "items": { "$ref": "#/$defs/tool" } },
      "optional": { "type": "array", "items": { "$ref": "#/$defs/tool" } } } },
    "extractor": { "type": "string", "minLength": 1 },
    "analyzers": { "type": "array", "items": { "type": "object", "required": ["name", "run", "requires"],
      "additionalProperties": false, "properties": {
        "name": { "type": "string" }, "run": { "type": "string" }, "requires": { "type": "string" } } } },
    "risk_weights": { "type": "object", "additionalProperties": { "type": "number" } },
    "loc_weight": { "type": "number" },
    "novelty_bonus": { "type": "number" },
    "value_bonus": { "type": "number" },
    "novelty_allowlist": { "type": "array", "items": { "type": "string" } },
    "unit_of_analysis": { "type": "string" },
    "clustering": { "type": "string" },
    "value_unit": { "type": "object", "required": ["name", "decimals"], "additionalProperties": false, "properties": {
      "name": { "type": "string" }, "decimals": { "type": "integer", "minimum": 0 } } },
    "code_fence": { "type": "string" },
    "modules_by_protocol": { "type": "object", "additionalProperties": { "type": "array", "items": { "type": "string" } } },
    "poc": { "type": "object", "required": ["framework", "run", "guide"], "additionalProperties": false, "properties": {
      "framework": { "type": "string" }, "run": { "type": "string" }, "guide": { "type": "string" } } },
    "fuzz": { "type": "object", "required": ["framework", "run", "guide"], "additionalProperties": false, "properties": {
      "framework": { "type": "string" }, "run": { "type": "string" }, "guide": { "type": "string" } } }
  },
  "$defs": {
    "tool": { "type": "object", "required": ["name", "check", "install"], "additionalProperties": false, "properties": {
      "name": { "type": "string" }, "check": { "type": "string" }, "install": { "type": "string" },
      "purpose": { "type": "string" } } }
  }
}
