{
  "chain": "solidity",
  "id_prefix": "SOL",
  "extensions": [
    ".sol"
  ],
  "detect": {
    "markers": [
      "foundry.toml",
      "hardhat.config.js",
      "hardhat.config.ts",
      "truffle-config.js"
    ],
    "contains": [],
    "fallback_glob": "**/*.sol"
  },
  "scope": {
    "include": [
      "contracts/PositionManager/OptionsPositionManager.sol",
      "contracts/GeVault.sol",
      "contracts/TokenisableRange.sol",
      "interfaces/IAaveLendingPoolV2.sol",
      "contracts/helper/V3Proxy.sol",
      "contracts/RangeManager.sol",
      "interfaces/IUniswapV2Router01.sol",
      "interfaces/INonfungiblePositionManager.sol",
      "interfaces/ILendingPoolConfigurator.sol",
      "contracts/PositionManager/PositionManager.sol",
      "contracts/helper/LPOracle.sol",
      "interfaces/IAaveIncentivesController.sol",
      "contracts/RoeRouter.sol",
      "interfaces/ISwapRouter.sol",
      "interfaces/IUniswapV2Pair.sol",
      "contracts/helper/FixedOracle.sol",
      "interfaces/IAToken.sol",
      "interfaces/PoolAddress.sol",
      "contracts/helper/OracleConvert.sol",
      "interfaces/ILendingPoolAddressesProvider.sol",
      "interfaces/AggregatorV3Interface.sol",
      "interfaces/IUniswapV3Factory.sol",
      "interfaces/IInitializableAToken.sol",
      "interfaces/DataTypes.sol",
      "interfaces/IUniswapV3Pool.sol",
      "interfaces/IERC721Permit.sol",
      "interfaces/IFlashLoanReceiver.sol",
      "interfaces/IUniswapV2Factory.sol",
      "interfaces/ICreditDelegationToken.sol",
      "interfaces/IERC20.sol",
      "interfaces/IPeripheryPayments.sol",
      "interfaces/IPoolInitializer.sol",
      "interfaces/IWETH.sol",
      "interfaces/IUniswapV3SwapCallback.sol",
      "interfaces/IAaveOracle.sol",
      "interfaces/IScaledBalanceToken.sol",
      "interfaces/IPeripheryImmutableState.sol",
      "interfaces/IPriceOracle.sol"
    ],
    "exclude": [
      "**/test/**",
      "**/tests/**",
      "**/mock/**",
      "**/mocks/**",
      "**/script/**",
      "**/scripts/**",
      "**/lib/**",
      "**/node_modules/**",
      "**/out/**",
      "**/artifacts/**",
      "**/forge-std/**",
      "**/*.t.sol",
      "**/*.s.sol"
    ],
    "fallback_include": []
  },
  "tools": {
    "required": [
      {
        "name": "python3",
        "check": "python3 --version",
        "install": "https://www.python.org/downloads/",
        "purpose": "ChainSec scripts"
      },
      {
        "name": "forge",
        "check": "forge --version",
        "install": "curl -L https://foundry.paradigm.xyz | bash && foundryup",
        "purpose": "compiler-mode facts, PoC, fuzz"
      }
    ],
    "optional": [
      {
        "name": "slither",
        "check": "slither --version",
        "install": "pipx install slither-analyzer",
        "purpose": "static-analysis signal table during recon"
      }
    ]
  },
  "extractor": "recon/extract.sh",
  "analyzers": [
    {
      "name": "slither",
      "run": "recon/slither-summary.py",
      "requires": "slither"
    }
  ],
  "risk_weights": {
    "external_calls": 5,
    "state_writers": 4,
    "payable": 4,
    "assembly_blocks": 6,
    "unchecked_blocks": 3
  },
  "loc_weight": 0.05,
  "novelty_bonus": 15,
  "value_bonus": 10,
  "novelty_allowlist": [
    "**/openzeppelin*/**",
    "**/@openzeppelin/**",
    "**/solmate/**",
    "**/solady/**"
  ],
  "unit_of_analysis": "inheritance_cluster",
  "clustering": "recon/clustering.md",
  "value_unit": {
    "name": "wei",
    "decimals": 18
  },
  "code_fence": "solidity",
  "modules_by_protocol": {
    "always": [
      "../../domains/defi/modules/access-control-state.md"
    ],
    "dex-amm": [
      "../../domains/defi/modules/amm-mev-deep.md",
      "../../domains/defi/modules/economic-design.md",
      "../../domains/defi/modules/flash-loan-interaction.md",
      "../../domains/defi/primers/defi-dex-amm.md"
    ],
    "lending": [
      "../../domains/defi/modules/lending-liquidation-deep.md",
      "../../domains/defi/modules/oracle-analysis.md",
      "modules/oracle-analysis.md",
      "../../domains/defi/modules/economic-design.md",
      "../../domains/defi/primers/defi-lending.md"
    ],
    "vault": [
      "../../domains/defi/modules/vault-share-accounting.md",
      "modules/erc4626-vault-deep.md",
      "../../domains/defi/modules/flash-loan-interaction.md"
    ],
    "governance": [
      "../../domains/defi/modules/governance-voting.md",
      "../../domains/defi/primers/defi-staking-governance.md"
    ],
    "staking": [
      "../../domains/defi/modules/economic-design.md",
      "../../domains/defi/primers/defi-staking-governance.md"
    ],
    "nft-gamefi": [
      "../../domains/defi/primers/gamefi-nft.md",
      "modules/eip-standard-compliance.md"
    ],
    "bridge": [
      "../../domains/defi/modules/cross-chain-bridge.md",
      "modules/cross-chain-bridge.md",
      "../../domains/defi/primers/bridge-crosschain.md"
    ],
    "proxy-upgradeable": [
      "primers/proxy-upgrades.md"
    ],
    "wallet-aa": [
      "primers/wallet-safe-aa.md",
      "modules/account-abstraction-erc4337.md",
      "modules/eip7702-delegation.md"
    ]
  },
  "poc": {
    "framework": "foundry",
    "run": "cd <TARGET>/<root> && FOUNDRY_TEST=<TARGET>/.audit/solidity/poc/<ID> forge test --match-path '*/<test file>' -vvv",
    "guide": "poc/guide.md"
  },
  "fuzz": {
    "framework": "foundry-invariant",
    "run": "cd <TARGET>/<root> && FOUNDRY_TEST=<TARGET>/.audit/solidity/fuzz/tests forge test --match-path '*/<test file>' -vvv",
    "guide": "fuzz/guide.md"
  }
}
